N,Dato,name,website,address,Email 1,phone,city,type,Email 2,Email 3
1,Google,Hotel Splash Inn Nuevo Vallarta,https://gruposplash.com/hotelsplashinnvallarta/,"Puerto Vallarta - Tepic 163, Colonia Jacarandas, 63735 Nuevo Vallarta, Nay., Mexico",ideas@quimaira.com,322 297 0568,Puerto Vallarta,Hotel,,
1,Google,One Puerto Vallarta Aeropuerto,https://www.onehoteles.com/hoteles/one-puerto-vallarta-aeropuerto,"Blvd. Francisco Medina Ascencio 3987, Área Militar de Vallarta, 48335 Puerto Vallarta, Jal., Mexico",recep1pvap@posadas.com,322 176 1040,Puerto Vallarta,Hotel,,
1,Google,Hostel Vallarta,http://www.hostelvallarta.com/,"C. Juárez 535, Proyecto escola, Centro, 48300 Puerto Vallarta, Jal., Mexico",hostelvallarta@gmail.com,55 5493 4026,Puerto Vallarta,Hotel,,
1,Google,Encino Hotel Puerto Vallarta,https://www.encino-hotel.com/,"C. Juárez 122, Centro, 48300 Puerto Vallarta, Jal., Mexico",hotelencino@hotmail.com,322 222 0051,Puerto Vallarta,Hotel,,
1,Google,Hotel Eloisa,http://www.hoteleloisa.com/es?partner=10156utm_source=google&utm_medium=organic&utm_campaign=MyBusiness&utm,"Lázaro Cárdenas 179, Zona Romántica, Emiliano Zapata, 48380 Puerto Vallarta, Jal., Mexico",,322 222 6465,Puerto Vallarta,Hotel,,
1,Google,Hotel Rio Malecon,https://www.hotelrio.com.mx/,"Morelos 170, Centro, 48300 Puerto Vallarta, Jal., Mexico",reserva@hotelrio.com.mx,322 222 0366,Puerto Vallarta,Hotel,,
1,Google,Costa Club Punta Arena,https://www.hotelcostaclub.mx/,"Blvd. Francisco Medina Ascencio 1737, Zona Hotelera, Zona Hotelera Nte., 48333 Puerto Vallarta, Jal., Mexico",reservaciones@hotelcostaclub.com,322 226 9654,Puerto Vallarta,Hotel,,
1,Google,Hacienda de Vallarta Centro,https://haciendavallartacentro.com/,"Insurgentes 322, Zona Romántica, Emiliano Zapata, 48380 Puerto Vallarta, Jal., Mexico",,322 222 4540,Puerto Vallarta,Hotel,,
1,Google,Hotel Krystal Puerto Vallarta,https://www.krystal-puertovallarta.com/?partner=7423&utm_source=google&utm_medium=organic&utm_campaign=MyBusiness,"Av. Francisco Medina Ascencio S/N, Zona Hotelera, Zona Hotelera Nte., 48333 Puerto Vallarta, Jal., Mexico",reservaciones.kvta@krystal-hotels.com,322 226 0700,Puerto Vallarta,Hotel,recepcionvallarta@krystal-hotels.com,
1,Google,Holiday Inn Express Puerto Vallarta,https://www.ihg.com/holidayinnexpress/hotels/us/en/puerto-vallarta/pvrfl/hoteldetail?cm_mmc=GoogleMaps-_-EX-_-MX-_-PVRFL,"Blvd. Francisco Medina Ascencio 3974, Villa Las Flores, 48356 Puerto Vallarta, Jal., Mexico",,322 226 7760,Puerto Vallarta,Hotel,,
1,Google,Costa Sur Resort & Spa Puerto Vallarta,https://www.costasurpuertovallarta.com/,"Carretera hacia Barra de Navidad, Sur, 48390 Puerto Vallarta, Jal., Mexico",reservaciones@costasurpuertovallarta.com,322 226 8050,Puerto Vallarta,Hotel,,
1,Google,Fiesta Inn Puerto Vallarta Isla,https://www.fiestainn.com/hoteles/fiesta-inn-puerto-vallarta-isla,"Blvd. Francisco Medina Ascencio 2479-Interior A, Zona Hotelera, Zona Hotelera Nte., 48333 Puerto Vallarta, Jal., Mexico",gshfipvt@posadas.com,322 688 1550,Puerto Vallarta,Hotel,,
1,Google,Hotel Suites Nadia Puerto Vallarta,https://vallarta.hotelsuitesnadia.com/,"Uruguay 127, 5 de Diciembre, 48350 Puerto Vallarta, Jal., Mexico",info@hotelsuitesnadia.com,329 116 6185,Puerto Vallarta,Hotel,,
1,Google,Puerto de Luna,https://puertodeluna.com/?utm_source=google&utm_medium=gmb&utm_campaign=googleMyBusiness,"BLVD. Francisco Medina Ascencio. 2500, Zona Hotelera Norte, Puerto Vallarta. C.P. 48333, Fluvial Vallarta, 48333 Puerto Vallarta, Jal., Mexico",puertodeluna@rsvteam.com,322 225 0480,Puerto Vallarta,Hotel,,
1,Google,Casa Adriana,http://www.casaadriana.mxhotel.site/,"Niza 140, Versalles, 48310 Puerto Vallarta, Jal., Mexico",,322 205 1060,Puerto Vallarta,Hotel,,
1,Google,City Express Plus by Marriott Puerto Vallarta,https://www.marriott.com/en-us/hotels/pvrpp-city-express-plus-puerto-vallarta/overview/?scid=f2ae0541-1279-4f24-b197-a979c79310b0,"Blvd. Francisco Medina Ascencio 2860, Zona Hotelera Nte., 48333 Puerto Vallarta, Jal., Mexico",,322 226 3760,Puerto Vallarta,Hotel,,
1,Google,Marboka Hotel & Suites,https://hotelmarboka.com/,"Carr. Costera a Barra de Navidad Km 2.5-1130, Conchas Chinas, 48399 Puerto Vallarta, Jal., Mexico",reservaciones@hotelconchaschinas.com,322 221 5763,Puerto Vallarta,Hotel,hola@hotelmarboka.com,
1,Google,Hotel Mio Vallarta,https://hotelmiovallarta.com/,"Blvd. Francisco Medina Ascencio 2179-A, Zona Hotelera, Zona Hotelera Nte., 48333 Puerto Vallarta, Jal., Mexico",reservas@hotelmiovallarta.com,322 226 3923,Puerto Vallarta,Hotel,,
1,Google,Hotel Ixaya,https://www.facebook.com/hotelixaya?locale=es_LA,"Sierra Pirineos 181-altos, Olímpica, 48330 Puerto Vallarta, Jal., Mexico",ixaya.hotel@hotmail.com,322 329 9255,Puerto Vallarta,Hotel,,
1,Google,Las Palmas by The Sea,https://www.laspalmasresort.com/,"Pablo Picasso 126-121, Zona Hotelera, Las Glorias, 48333 Puerto Vallarta, Jal., Mexico",reservaciones@laspalmasresort.com,322 226 1220,Puerto Vallarta,Hotel,,
1,Google,Tradicional Hotel Villa Del Mar,http://www.hvilladelmar.com/,"C. Fco. I. Madero 440, Zona Romántica, Emiliano Zapata, 48380 Puerto Vallarta, Jal., Mexico",h_villadelmar@hotmail.com,322 222 2885,Puerto Vallarta,Hotel,,
1,Google,Hampton by Hilton Nuevo Vallarta,https://www.hilton.com/en/hotels/pvrnvhx-hampton-nuevo-vallarta/?SEO_id=GMB-AMER-HX-PVRNVHX&y_source=1_MzYyMDEwMjktNzE1LWxvY2F0aW9uLndlYnNpdGU%3D,"Carr. Federal, 200 Tepic-Puerto Vallarta Nuevo Vallarta, 63735 Las Jarretaderas, Nay., Mexico",,329 111 5000,Puerto Vallarta,Hotel,,
1,Google,Hotel Mar Caribe Puerto Vallarta,https://hotelmarcaribe.mxhotel.site/,"Av. Politecnico Nacional 346 entre Mar Quimixto y, Mar Caribe Fracc, Villas del Mar, 48315 Puerto Vallarta, Jal., Mexico",,322 299 2276,Puerto Vallarta,Hotel,,
1,Google,Hotel Suites Mar Elena,http://www.suitesmarelena.com/,"Jose Clemente Orozco #503, Zona Hotelera, Las Glorias, 48333 Puerto Vallarta, Jal., Mexico",reservaciones@suitesmarelena.com,800 536 3191,Puerto Vallarta,Hotel,,
1,Google,Loft Hotel Malecón Vallarta,https://www.lofthotelmaleconvallarta.com/,"Paseo Díaz Ordaz 920 48300, Centro, 48300 Puerto Vallarta, Jal., Mexico",,322 222 8088,Puerto Vallarta,Hotel,,
1,Google,Krystal Grand Puerto Vallarta,https://www.krystalgrand-puertovallarta.com/?partner=7423&utm_source=google&utm_medium=organic&utm_campaign=MyBusiness,"Av. de las Garzas 136, Zona Hotelera, Zona Hotelera Nte., 48333 Puerto Vallarta, Jal., Mexico",pvrpv.reservations@krystalgrand-hotels.com,322 176 1176,Puerto Vallarta,Hotel,calidad.kgpv@krystal-hotels.com,recepcion.kgpv@krystal-hotels.com
1,Google,Buenaventura Grand Hotel & Great Moments,http://www.hotelbuenaventura.com.mx/home,"Av México 1301, 5 de Diciembre, 48310 Puerto Vallarta, Jal., Mexico",callcenter@buenaventurahoteles.com,800 363 7466,Puerto Vallarta,Hotel,emarketing@buenaventurahoteles.com,
1,Google,Hotel Vallartasol,http://www.vallartasol.com.mx/,"Lucerna 109, Díaz Ordaz, 48310 Puerto Vallarta, Jal., Mexico",,322 115 6278,Puerto Vallarta,Hotel,,
1,Google,Alexandross Hostel Bed and Breakfast,http://www.alexandrossbnb.com/,"Lázaro Cárdenas 330 B, Zona Romántica, Emiliano Zapata, 48380 Puerto Vallarta, Jal., Mexico",info@alexandrossbnb.com,322 156 3335,Puerto Vallarta,Hotel,,
1,Google,Comfort Inn Puerto Vallarta,https://www.choicehotels.com/es-us/jalisco/puerto-vallarta/comfort-inn-hotels/mx061,"Blvd. Francisco Medina Ascencio 3965, Marina Vallarta, 48335 Puerto Vallarta, Jal., Mexico",,322 226 7979,Puerto Vallarta,Hotel,,
1,Google,Soy Local Puerto Vallarta,http://www.soylocal.co/,"Francia 100, Versalles, 48310 Puerto Vallarta, Jal., Mexico",comercial@soylocal.co,322 224 2213,Puerto Vallarta,Hotel,,
1,Google,Marriott Puerto Vallarta Resort & Spa,https://www.marriott.com/en-us/hotels/pvrmx-marriott-puerto-vallarta-resort-and-spa/overview/?scid=f2ae0541-1279-4f24-b197-a979c79310b0,"Av Paseo de la Marina Nte 435, Marina Vallarta, 48335 Puerto Vallarta, Jal., Mexico",,322 226 0000,Puerto Vallarta,Hotel,,
1,Google,Casa Colibrí Malecón,https://www.booking.com/Share-d8JJeC,"Pipila 160, Centro, 48300 Puerto Vallarta, Jal., Mexico",,,Puerto Vallarta,Hotel,,
1,Google,Blue Chairs Resort by the Sea Puerto Vallarta,https://www.bluechairs.com/?partner=5992utm_source=google&utm_medium=organic&utm_campaign=MyBusiness&utm,"Malecón 4, Zona Romántica, Emiliano Zapata, 48380 Puerto Vallarta, Jal., Mexico",reservations@bluechairs.com,322 222 5040,Puerto Vallarta,Hotel,,
1,Google,Hotel Posada de Roger,https://hotelposadaderoger.com/,"Basilio Badillo 237, Zona Romántica, Emiliano Zapata, 48380 Puerto Vallarta, Jal., Mexico",reservations@hotelposadaderoger.com,322 222 0836,Puerto Vallarta,Hotel,,
1,Google,Grand Miramar Resort,https://www.grandmiramar.com/?utm_source=google&utm_medium=gmb&utm_campaign=googleMyBusiness,"P.º de Los Corales 139, Conchas Chinas, 48390 Puerto Vallarta, Jal., Mexico",grandmiramar@rsvteam.com,33 1493 2744,Puerto Vallarta,Hotel,,
1,Google,Hyatt Ziva Puerto Vallarta,https://www.hyatt.com/en-US/hotel/mexico/hyatt-ziva-puerto-vallarta/pvrif?src=corp_lclb_google_seo_pvrif&%3Futm_source=google&utm_medium=organic&utm_campaign=lmr,"Carretera a Barra de Navidad, Km. 3.5, Zona Hotelera, Sur, 48390 Puerto Vallarta, Jal., Mexico",,322 226 5000,Puerto Vallarta,Hotel,,
1,Google,Hilton Vallarta Riviera All-Inclusive Resort,https://www.hilton.com/en/hotels/pvrpahh-hilton-vallarta-riviera-all-inclusive-resort/?SEO_id=GMB-AMER-HH-PVRPAHH&y_source=1_MjYxMDYyODUtNzE1LWxvY2F0aW9uLndlYnNpdGU%3D,"Carr Barra De Navidad Km4.5, Zona Hotelera, Sur, 48390 Puerto Vallarta, Jal., Mexico",,322 176 1300,Puerto Vallarta,Hotel,,
1,Google,Holiday Inn & Suites Puerto Vallarta Marina & Golf an IHG Hotel,http://holidayinn.com/puertovallarta,"Blvd. Francisco Medina Ascencio 3650, Villa Las Flores, 48335 Puerto Vallarta, Jal., Mexico",,322 252 0070,Puerto Vallarta,Hotel,,
1,Google,Hotel Delfin PV Beach Resort,https://www.delfinpvbeachresort.com/,"Calle :, C. Rodolfo Gómez 111, Zona Romántica, Emiliano Zapata, 48380 Puerto Vallarta, Jal., Mexico",reservas@hdelfinpv.com,322 222 3050,Puerto Vallarta,Hotel,,
1,Google,Teocalli Hostel,https://www.teocallihostel.com/,"C. Juárez 189, Centro, 48300 Puerto Vallarta, Jal., Mexico",reservations@teocallihostel.com,,Puerto Vallarta,Hotel,,
1,Google,Almar Resort Luxury LGBT Beach Front Experience,https://almarresort.com/,"Amapas 380, Zona Romántica, Emiliano Zapata, 48380 Puerto Vallarta, Jal., Mexico",info@almarresort.com,322 222 4888,Puerto Vallarta,Hotel,,
1,Google,Oasis Hostel,https://www.oasishostel.com/,"Av.Luis Donaldo Colosio #222 Col, Benito Juárez, 48389 Puerto Vallarta, Jal., Mexico",,322 222 2636,Puerto Vallarta,Hostel,,
1,Google,Los Muertos Hostal,http://www.facebook.com/losmuertoshostalpv,"Manuel M. Dieguez 138D, Zona Romántica, Emiliano Zapata, 48380 Puerto Vallarta, Jal., Mexico",,322 223 0466,Puerto Vallarta,Hostel,,
1,Google,Canova Hostel,https://canovahostel.com/,"Colombia 1415, 5 de Diciembre, 48350 Puerto Vallarta, Jal., Mexico",,322 260 6811,Puerto Vallarta,Hostel,,
1,Google,Hostal Vive Alegría,https://www.vivealegria.com/,"Av. Francisco Medina Ascencio 1774, Olímpica, 48330 Puerto Vallarta, Jal., Mexico",hostelvivealegria@gmail.com,322 102 9254,Puerto Vallarta,Hostel,info@vivealegria.com,
1,Google,Lifestyle Properties PV,http://lifestylepropertiespv.com/,"Venustiano Carranza #290-Local 1, Zona Romántica, Emiliano Zapata, 48380 Puerto Vallarta, Jal., Mexico",info@lifestylepropertiespv.com,(800) 214 8902,Puerto Vallarta,Property management,,
1,Google,Puerto Vallarta Property Rentals,https://www.puertovallartapropertyrentals.com/,"C. Ecuador 1209, 5 de Diciembre, 48350 Puerto Vallarta, Jal., Mexico",,322 107 4143,Puerto Vallarta,Property management,,
1,Google,MS Puerto Vallarta Rentals,http://www.mspvrentals.com/,"Venustiano Carranza 501, Zona Romántica, Emiliano Zapata, 48380 Puerto Vallarta, Jal., Mexico",hello@favethemes.com,322 109 0629,Puerto Vallarta,Property management,,
1,Google,Bay Property And Rentals Zona Romantica,http://www.baypropertypv.com/,"Basilio Badillo 180, Zona Romántica, Emiliano Zapata, 48380 Puerto Vallarta, Jal., Mexico",contact@bayproperty.mx,322 142 8048,Puerto Vallarta,Property management,,
1,Google,Naya Homes,http://nayahomes.co/,"Basilio Badillo 261, Zona Romántica, Emiliano Zapata, 48380 Puerto Vallarta, Jal., Mexico",hello@nayahomes.co,322 116 2848,Puerto Vallarta,Property management,,
1,Google,The Property Girl,http://thepropertygirl.com/,"F27 Plaza Caracol, Blvd. Francisco Medina Ascencio 2190, Zona Hotelera, 48333 Puerto Vallarta, Jal., Mexico",info@thepropertygirl.com,322 158 5452,Puerto Vallarta,Property management,,
1,Google,UHome Rentals Puerto Vallarta,https://uhome.io/,"Av. Francisco Medina Ascencio 3987-Local 8, Marina Vallarta, 48354 Puerto Vallarta, Jal., Mexico",matt@pixelspread.com,322 135 8494,Puerto Vallarta,Property management,hello@rfuenzalida.com,impallari@gmail.com
1,Google,"Vallarta Dream Sales, Rentals & Management",https://vallartadream.com/,"C. Cardenal 99A, Los Sauces, 48328 Puerto Vallarta, Jal., Mexico",hola@vallartadream.com,322 223 3509,Puerto Vallarta,Property management,hola@vallartadream.com.com,
1,Google,VallartaPM,https://www.vallartapm.com/,"Av. Francisco Villa 1010-Local 5, Las Gaviotas, 48328 Puerto Vallarta, Jal., Mexico",,322 206 4809,Puerto Vallarta,Property management,,
1,Google,Puerto Vallarta Rental Properties,http://puertovallartarentalproperties.com/,"Venustiano Carranza 290, Zona Romántica, Emiliano Zapata, 48380 Puerto Vallarta, Jal., Mexico",,322 305 8373,Puerto Vallarta,Property management,,
1,Google,CENTURY 21 Bayside Properties Puerto Vallarta,https://century21baysideproperties.com/,"Av. Francisco Medina Ascencio 2053-3, Zona Hotelera, Las Glorias, 48333 Puerto Vallarta, Jal., Mexico",frank@c21bayside.com,322 224 8876,Puerto Vallarta,Property management,email@email.com,danielmtz@c21bayside.com
1,Google,"HIGH END Boutique condo rental, management, real estate. Your satisfaction is our priority",http://www.hepvrmx.com/,"Otilo Montaño 109, Primavera de Vallarta, 48313 Puerto Vallarta, Jal., Mexico",info@hepvrmx.com,322 292 0785,Puerto Vallarta,Property management,,
1,Google,Pacific Coast Realty,https://pacificcoastmexico.com/,"Plaza Marina Local D-20, Fluvial Vallarta, 48312 Puerto Vallarta, Jal., Mexico",,322 221 1098,Puerto Vallarta,Property management,,
1,Google,Jalisco Real Estate,https://jaliscorealestate.com/,"Francia 112, Versalles, 48310 Puerto Vallarta, Jal., Mexico",info@jaliscorealestate.com,322 889 7733,Puerto Vallarta,Property management,,
1,Google,PV Realty,http://pvre.com/,"Av México 1320-Local 2, 5 de Diciembre, 48350 Puerto Vallarta, Jal., Mexico",info@pvre.com,322 222 4288,Puerto Vallarta,Property management,,
1,Google,PVR Prop,http://www.pvrprop.com/,"Rep. de Chile 267, 5 de Diciembre, 48350 Puerto Vallarta, Jal., Mexico",service@pvrprop.com,(209) 386 7767,Puerto Vallarta,Property management,,
1,Google,Samson Waters Vacation Rentals & Property Management,http://www.samsonwaters.com/,"Insurgentes 120, Zona Romántica, Emiliano Zapata, 48380 Puerto Vallarta, Jal., Mexico",inquiries@samsonwaters.com,322 596 1771,Puerto Vallarta,Property management,,
1,Google,Reliable Rentals,http://reliablerentals.mx/,"Av. Francisco Medina Ascencio 2467-Int. L14, Zona Hotelera, Las Glorias, 48333 Puerto Vallarta, Jal., Mexico",info@reliablerentals.mx,322 365 1286,Puerto Vallarta,Property management,,
1,Google,Palmera Vacations,http://www.palmeravacations.com/,"Libertad 349, Centro, 48300 Puerto Vallarta, Jal., Mexico",mazatlan@palmeravacations.com,322 223 0101,Puerto Vallarta,Property management,vallarta@palmeravacations.com,
1,Google,Hansa Rentals,http://www.hansarentals.my.canva.site/,"Durango 672, La Floresta, 48290 Puerto Vallarta, Jal., Mexico",,322 137 6469,Puerto Vallarta,Property management,,
1,Google,Mexpat Realtors,http://www.mexpatrealtors.com/options,"Av Fluvial Vallarta 239, Fluvial Vallarta, 48312 Puerto Vallarta, Jal., Mexico",,322 308 0014,Puerto Vallarta,Property management,,
1,Google,Pam's PV Property,http://pamspvproperty.com/,"Priv. Allende 100, Cerro, 48350 Puerto Vallarta, Jal., Mexico",pampvproperty@gmail.com,415 236 1306,Puerto Vallarta,Property management,,
1,Google,Timothy Real Estate Group,https://www.timothyrealestategroup.com/,"Ignacio L. Vallarta 130-Local 7, Zona Romántica, Emiliano Zapata, 48380 Puerto Vallarta, Jal., Mexico",inspired@timothyrealestategroup.com,322 223 5300,Puerto Vallarta,Property management,,
1,Google,FRANCO&ASSOCIATES- Accounting & Administration,http://francopv.com/,"C. Constitución #285 A, Zona Romántica, Emiliano Zapata, 48380 Puerto Vallarta, Jal., Mexico",,322 365 1699,Puerto Vallarta,Property management,,
1,Google,Vallarta Sunset Properties,http://www.vallartasunset.com/,"Carr. Costera a Barra de Navidad 518-Int 5, Zona Romántica, Emiliano Zapata, 48390 Puerto Vallarta, Jal., Mexico",,322 223 5511,Puerto Vallarta,Property management,,
1,Google,Exotic Realty,http://www.exoticrealty.com/,"Av. Paseo de la Marina Sur 161-Local 2, Marina Vallarta, 48335 Puerto Vallarta, Jal., Mexico",info@exoticrealty.com,322 221 2377,Puerto Vallarta,Property management,,
1,Google,CasaHill Properties,https://www.casahill.com/,"Venustiano Carranza 311-A, Zona Romántica, Emiliano Zapata, 48380 Puerto Vallarta, Jal., Mexico",sales@casahill.com,(623) 276 6397,Puerto Vallarta,Property management,kash@casahill.com,
1,Google,Ron Morgan Properties,https://ronmorgan.net/,"Olas Altas 509, Zona Romántica, Amapas, 48399 Puerto Vallarta, Jal., Mexico",info@ronmorgan.net,322 222 6678,Puerto Vallarta,Property management,,
1,Google,Ferrari Realty,https://ferrari-realty.ueniweb.com/?utm_campaign=gmb,"Francisco Medina Ascencio, Plaza Villas Vallarta, Loc. B-28, Zona Hotelera, Las Glorias, 48333 Puerto Vallarta, Jal., Mexico",ferrari.realty@yahoo.com,322 194 9558,Puerto Vallarta,Property management,,
1,Google,Geographica Property Management,https://www.geographica.com.mx/,"Guatemala 193, 5 de Diciembre, 48350 Puerto Vallarta, Jal., Mexico",cmarcela@geographica.com.mx,322 156 5717,Puerto Vallarta,Property management,admin@geographica.com.mx,geographicapm@gmail.com
1,Google,Harmonious Properties,https://www.harmoliving.com/,"C. Fco. I. Madero 328, Zona Romántica, Emiliano Zapata, 48380 Puerto Vallarta, Jal., Mexico",eben@eyebytes.com,322 104 4254,Puerto Vallarta,Property management,,
1,Google,PV Properties,http://pvproperties.com/,"Panamá 299, 5 de Diciembre, 48350 Puerto Vallarta, Jal., Mexico",info@pvproperties.com,322 980 0690,Puerto Vallarta,Property management,,
1,Google,Property Seekers México,https://propertyseekers.com.mx/,"Blvrd Riviera Nayarit 1480-local 23, 63735 Nuevo Nayarit, Nay., Mexico",info@propertyseekers.com.mx,322 286 8416,Puerto Vallarta,Property management,,
1,Google,Donner & Associates (Main Office),http://ryandonner.com/,"Insurgentes 120, Zona Romántica, Emiliano Zapata, 48380 Puerto Vallarta, Jal., Mexico",realtor@ryandonner.com,322 111 1162,Puerto Vallarta,Property management,,
1,Google,MF Properties,https://mfproperties.com.mx/,"Playa de Oro 126-15, Zona Hotelera, Zona Hotelera Nte., 48333 Puerto Vallarta, Jal., Mexico",contacto@mfproperties.com.mx,322 180 2211,Puerto Vallarta,Property management,,
1,Google,Vistalegre Puerto Vallarta Rentals,http://www.vistalegrerentals.com/,"Ignacio L. Vallarta 130-local 5, Zona Romántica, Emiliano Zapata, 48380 Puerto Vallarta, Jal., Mexico",info@vistalegrerentals.com,322 222 1666,Puerto Vallarta,Property management,,
1,Google,PVConcierge,http://www.pvconcierge.net/,"Venezuela 231, 5 de Diciembre, 48350 Puerto Vallarta, Jal., Mexico",info@pvconcierge.net,322 221 2039,Puerto Vallarta,Property management,,
1,Google,Cochran Real Estate,https://casasandvillas.com/,"Leona Vicario 230 - D, Centro, 48300 Puerto Vallarta, Jal., Mexico",,322 205 7550,Puerto Vallarta,Property management,,
1,Google,Kevin Victor | Real Estate,http://www.yourpvhome.com/,"Aquiles Serdán 382, Zona Romántica, Emiliano Zapata, 48380 Puerto Vallarta, Jal., Mexico",kevin@timothyrealestategroup.com,322 231 1415,Puerto Vallarta,Property management,,
1,Google,ALILA HOLIDAYS PV,http://alilaholidays.com/,"PIER 57 CONDOMINIOS, Francisca Rodríguez 174, Zona Romántica, Emiliano Zapata, 48380 Puerto Vallarta, Jal., Mexico",contact@alilaholidays.com,322 275 4622,Puerto Vallarta,Property management,,
1,Google,JACOBO,https://bienes-pv-y-bahia-ja-edu.ueniweb.com/?utm_campaign=gmb,"Rep. del Perú, Coapinole, 48290 Puerto Vallarta, Jal., Mexico",eduardoppvallarta@gmail.com,322 108 6396,Puerto Vallarta,Property management,,
1,Google,Tango Rentals - Vacation Rentals in Puerto Vallarta,http://www.tangorentals.com/,"Aquiles Serdán 410, Zona Romántica, Emiliano Zapata, 48380 Puerto Vallarta, Jal., Mexico",gretchenbas@tangorentals.com,13222247398,Puerto Vallarta,Property management,agustin@tangorentals.com,
1,Google,Remax Romantica,https://www.remax-romantica.com/,"Venustiano Carranza, Access from, Ignacio L. Vallarta 268-local 6, Zona Romántica, Emiliano Zapata, 48380 Puerto Vallarta, Jal., Mexico",,322 349 5426,Puerto Vallarta,Property management,,
1,Google,Puerto-Bahía Real Estate,https://puerto-bahia-real-estate.ueniweb.com/?utm_campaign=gmb,"C. Cándido Aguilar 174, 48291 Las Juntas, Jal., Mexico",caprichos13tony@hotmail.com,322 370 8769,Puerto Vallarta,Property management,,
1,Google,Realtors Vallarta | Real Estate Puerto Vallarta & Banderas Bay,https://www.realtorsvallarta.com/,"C. Fco. I. Madero 214, Zona Romántica, Emiliano Zapata, 48380 Puerto Vallarta, Jal., Mexico",info@realtorsvallarta.com,322 127 6847,Puerto Vallarta,Property management,,
1,Google,PVRPV - Your Vacation Experts!,http://pvrpv.com/,"Lázaro Cárdenas 205-Loc-6, Zona Romántica, Emiliano Zapata, 48380 Puerto Vallarta, Jal., Mexico",bucerias@pvrpv.com,322 222 0638,Puerto Vallarta,Property management,info@pvrpv.com,marina@pvrpv.com
1,Google,Berkshire Hathaway HomeServices Applegate Realtors,https://applegaterealtors.com/,"Edificio Rincón de Almas, C. Constitución 130-local 1, Zona Romántica, Emiliano Zapata, 48380 Puerto Vallarta, Jal., Mexico",info@applegaterealtors.com,322 688 4077,Puerto Vallarta,Property management,,
1,Google,David Pullen,http://www.davidpullenproperties.com/,"Mástil 2-local 2-B, Marina Vallarta, 48335 Puerto Vallarta, Jal., Mexico",info@davidpullenproperties.com,322 209 2188,Puerto Vallarta,Property management,,
1,Google,Puerto Vallarta Property Search,http://puertovallartapropertysearch.com/,"Blvd. Francisco Medina Ascencio 2216-A, Zona Hotelera Nte., 48333 Puerto Vallarta, Jal., Mexico",,760 895 7104,Puerto Vallarta,Property management,,
1,Booking,Altos de Aliwen,https://altosdealiwen.com/,,informes@altosdealiwen.com,,Potrero,,,
1,Booking,Amantea Apart Potrero de los Funes,https://www.amanteaapart.com.ar/,,amanteaapart@gmail.com,,Potrero,,,
1,Booking,Hotel Potrero De Los Funes,http://www.hotelpotrero.sanluis.gov.ar/,,reservas@hotelpotrero.sanluis.gov.ar,,Potrero,,,
1,Booking,Complejo Los Molles,https://complejolosmolles.com.ar/,,,,Potrero,,,
1,Booking,Casa tranquila para 6 con pileta,https://www.bedroomvillas.com/property/casa-quincho-con-pileta-confortable-para-6-personas/BC-11162621,,,,Potrero,,,
1,Booking,La Colina - Potrero de los Funes,https://www.instagram.com/lacolina_potrero/,,,,Potrero,,,
1,Booking,Estación del Lago,https://www.estaciondellago.com.ar/es/,,,,Potrero,,,
1,Booking,La Quebrada Apartamentos,https://www.facebook.com/LaQuebradaPotrero/,,laquebrada.apartamentos@gmail.com,,Potrero,,,
1,Booking,La Serena Cabañas,https://xn--laserenacabaas-1nb.com.ar/,,laserenapotrero@gmail.com,,Potrero,,,
1,Booking,Posada Valle del Sol,https://www.trivago.com.ar/es-AR/oar/casa-de-hu%C3%A9spedes-posada-valle-del-sol-potrero-de-los-funes?search=100-2710884,,,,Potrero,,,
1,Booking,Hostería Los Naranjos,https://www.facebook.com/potrerofunes/?locale=es_LA,,losnaranjosdepotrero@gmail.com,,Potrero,,,
1,Booking,AROMA DEL POTRERO,https://www.instagram.com/aromadelpotrero/,,,,Potrero,,,
1,Booking,Departamento con vista al lago,https://departamento-con-vista-al-lago-potrero-de-los-funes2.hotelsantaeulalia.com.ar/,,,,Potrero,,,
1,Booking,Murmullo del Río,https://www.instagram.com/murmullodelrio/?hl=es-la,,,,Potrero,,,
1,Booking,MONTEARENA POTRERO DE LOS FUNES,https://www.bedroomvillas.com/property/montearena-potrero-de-los-funes/BC-10249030,,,,Potrero,,,
1,Booking,Cabañas Luján,https://cabaniaslujan.com.ar/,,cabaniaslujan@gmail.com,,Potrero,,,
1,Booking,Cabañas las Calandrias,https://www.online-reservations.com/?hotelid=10366991,,,,Potrero,,,
1,Booking,Cabañas Pueblo de J e s u s,https://almundo.com.ar/hoteles/detalle/cabanas-del-potrero-748339356H,,,,Potrero,,,
1,Booking,Departamento en Altos del Lago,https://www.trivago.com.ar/es-AR/oar/casa-departamento-entero-altos-del-lago-potrero-de-los-funes?search=100-7367284,,,,Potrero,,,
1,Booking,Altos del Lago,https://www.trivago.com.ar/es-AR/oar/casa-o-departamento-entero-altos-del-lago-potrero-de-los-funes?search=100-7367284,,,,Potrero,,,
1,Booking,Estacion Potrero Cabañas y Habitaciones,https://almundo.com.ar/hoteles/detalle/estacion-potrero-cabanas-y-habitaciones-734526356H,,,,Potrero,,,
1,Booking,Piscoyaku Apart,http://www.piscoyaku.com.ar/,,info@piscoyaku.com,,Potrero,,,
1,Booking,Cabañas de Tronco Silvestre,https://www.online-reservations.com/?hotelid=4915364,,,,Potrero,,,
1,Booking,Terra Mia,https://www.trivago.com.ar/es-AR/oar/hotel-terra-mia-potrero-de-los-funes?search=100-6474838,,,,Potrero,,,
1,Booking,Curiol Boutique Hotel & Lounge,https://www.bedroomvillas.com/property/curiol-boutique-hotel/BC-10961686,,,,Potrero,,,
1,Booking,Hotel Bahia Esmeralda,https://www.bahia-principe.com/es/hoteles-en-republica-dominicana/resort-esmeralda/,,dpd.privacy@grupo-pinero.com,,Potrero,,info.esmeralda@bahia-principe.com,
