N,Dato,name,website,address,Email 1,phone,city,type,Email 2,Email 3
1,Google,Camino Verde Bed & Breakfast Monteverde,http://www.hotelcaminoverde.com/,"Next to Pulperia Las Orquídeas, Santa Elena, Monteverde, Puntarenas Province, Monteverde, 60109, Costa Rica",info@hotelcaminoverde.com,2645 6849,Monteverde,Hotel,,
1,Google,Hotel Almore,https://almoremonteverde.com/es/,"8547+WW, Provincia de Puntarenas, Monteverde, Costa Rica",reservas@almoremonteverde.com,8358 7038,Monteverde,Hotel,,
1,Google,El Establo Mountain Hotel,http://www.elestablo.com/,"Puntarenas Province, Monteverde, Costa Rica",info@elestablo.com,2645 5110,Monteverde,Hotel,,
1,Google,Hotel El Amanecer,https://janrecommends.eu/el-amanecer-costa-rica,"Barrio orquideas, Santa Elena, Monteverde, Monteverde 60109, Puntarenas Province, Monteverde, Costa Rica",,2645 5483,Monteverde,Hotel,,
1,Google,Hostel La Suerte,https://www.lasuerteforestlodge.com/es/,"Ruta Nacional Treciaria 606, Provincia de Puntarenas, Monteverde, Costa Rica",hostellasuerte@gmail.com,2645 6642,Monteverde,Hotel,,
1,Google,Hotel Cipreses Monteverde,http://www.cipresescr.com/,"C. 6, Provincia de Puntarenas, Monteverde, Costa Rica",reservas@cipresescr.com,2645 5455,Monteverde,Hotel,,
1,Google,Casa Jungle Monteverde Bed & Breakfast,http://www.casajunglemonteverde.com/,"C. Las Orquídeas, Provincia de Puntarenas, Monteverde, Barrio Orquídeas, 60109, Costa Rica",info@casajunglemonteverde.com,8965 3001,Monteverde,Hotel,,
1,Google,Hotel Bosque Verde Lodge,http://www.bosqueverdelodge.com/,"Iglesia Católica de Cañitas, un 1Km al norte. Al frente de la finca modelo Brenes, Provincia de Guanacaste, Monteverde, Costa Rica",info@bosqueverdelodge.com,2645 9907,Monteverde,Hotel,,
1,Google,Monteverde Lodge,http://www.monteverdelodge.com/,"400 m East from the Frog Pond, entrance on the right hand side of the road, Provincia de Puntarenas, Monteverde, 60109, Costa Rica",info@monteverdelodge.com,(800) 963 1195,Monteverde,Hotel,,
1,Google,Mar Inn B & B (Bed and Breakfast),http://monteverdemarinn.com/,"400 metros Norte Banco Nacional de, C. 8, Puntarenas Province, Monteverde, 60109, Costa Rica",info@monteverdemarinn.com,2645 5279,Monteverde,Hotel,,
1,Google,Hotel Las Ardillas Monteverde,https://www.hotellasardillas.com/es/,"Cerro plano, Provincia de Puntarenas, Monteverde, Costa Rica",hotellasardillas.info@gmail.com,8632 5980,Monteverde,Hotel,,
1,Google,Hotel Monteverde EcoLodge,http://www.monteverdeecolodge.com/,"200 norte y 100 oeste del Banco de, Provincia de Puntarenas, Monteverde, 60109, Costa Rica",info@monteverdeecolodge.com,2645 7262,Monteverde,Hotel,,
1,Google,Hotel Los Jardines - Monteverde,https://www.hoteljardinesdemonteverde.com/contact/,"Cerro Plano, Los Jardines Lane, Provincia de Puntarenas, Monteverde, 61201, Costa Rica",webmaster@hoteljardinesdemonteverde.com,2645 6038,Monteverde,Hotel,,
1,Google,Mountain Faro Hotel,http://www.mountainfaro.com/,"Cerroplano, Barrio el Sapo, Provincia de Puntarenas, Monteverde, Costa Rica",sebastian@aldusleaf.org,8607 4455,Monteverde,Hotel,,
1,Google,Ocotea Boutique Hotel,http://costarica.ocoteahotel.com/,"Ruta 620, Santa Elena- Monteverde, Bo El Sapo Dorado, Provincia de Puntarenas, Monteverde, Costa Rica",reservations@ocoteahotel.com,4002 2599,Monteverde,Hotel,,
1,Google,Heliconia,https://www.hotelheliconia.com/es,"Hotel Heliconia, Provincia de Puntarenas, Monteverde, 60109, Costa Rica",sales@sbhotelscr.com ,4001 5826,Monteverde,Hotel,,
1,Google,Jaguarundi Lodge Monteverde,https://jaguarundilodge.com/,"Puntarenas Province, Monteverde, Costa Rica",sales@sbhotelscr.com,4001 5826,Monteverde,Hotel,,
1,Google,Monteverde Country Lodge,http://www.monteverdecountrylodge.com/,"300 Mts Sureste de la Escuela de Cerro Plano, Puntarenas Province, Santa Elena, Costa Rica",info@monteverdecountrylodge.com,2645 7600,Monteverde,Hotel,,
1,Google,Manakin Lodge Monteverde,https://thehoteldetail.eu/manakin-bird-lodge-monteverde-costa-rica,"3k before the Cloud forest Monteverde and 1k from, Monteverde, Puntarenas, Puntarenas Province, Monteverde, Costa Rica",,2645 5080,Monteverde,Hotel,,
1,Google,Monteverde Family House,https://costaricafamilyhouse.com/,"150 meters south west from downtown, Sta. Elena, Provincia de Puntarenas, Monteverde, 60109, Costa Rica",,8607 4455,Monteverde,Hotel,,
1,Google,Sleepers Sleep Cheaper Hostel,https://visitmonteverde.com/sleepers,"858G+QG, Puntarenas Province, Monteverde, 5655, Costa Rica",,8656 4848,Monteverde,Hotel,,
1,Google,Cabinas Selva Verde,https://www.booking.com/hotel/cr/cabinas-selva-verde.es.html?label=gen173nr-1DCAsoM0ITY2FiaW5hcy1zZWx2YS12ZXJkZUgKWARoM4gBAZgBCrgBGMgBDNgBA-gBAfgBA4gCAagCBLgCltPwiAbAAgHSAiQ1ZjZhZjFlNC05OTljLTRjMTEtYmI2NC1lMjcxNTYyY2NiYzTYAgTgAgE&sid=8924cc2a65505f469c0b5c2577bf115a&dist=0&keep_landing=1&sb_price_type=total&type=total&activeTab=main,"cabinas selva verde continuo a Gollo, Provincia de Puntarenas, Monteverde, 60109, Costa Rica",,8778 5347,Monteverde,Hotel,,
1,Google,Hotel Holístico Monteverde,http://hotelholisticomonteverde.com/,"600 mts noroeste de la, 85GF+F84 Plaza de Deportes, C. Campo Verde, Puntarenas Province, Monteverde, 60109, Costa Rica",info@hotelholisticomonteverde.com,2645 5152,Monteverde,Hotel,,
1,Google,Dreams Lodge,http://dreamslodgemonteverde.com/,"400 m Sur Oeste de la Escuela Primaria, Cerro Plano, Provincia de Puntarenas, Monteverde, 60109, Costa Rica",antoniomq27@gmail.com,2645 7590,Monteverde,Hotel,,
1,Google,Pensión y Cabinas Colibrí,https://pensiónycabinascolibrí.gohotel.com.es/,"Calle 5 8, Provincia de Puntarenas, Santa Ana, Costa Rica",,2645 5682,Monteverde,Hotel,,
1,Google,Hotel La Puesta del Sol,http://www.lapuestadelsolcr.com/,"500m southwest from Supercompro supermarket, Santa Elena, Monteverde, Barrio Orquideas, Provincia de Puntarenas, Monteverde, 60109, Costa Rica",,2645 5130,Monteverde,Hotel,,
1,Google,Historias Lodge,https://historiaslodge.gohotel.com.es/,"857M+P29, Puntarenas Province, Monteverde, 60109, Costa Rica",,2645 6914,Monteverde,Hotel,,
1,Google,Hotel Santa Fe,http://www.hotelsantafecr.com/,"620, Provincia de Puntarenas, Monteverde, Costa Rica",santafemonteverde@gmail.com,2645 6050,Monteverde,Hotel,,
1,Google,Trapp Family Lodge,http://www.trapphotelmonteverde.com/app/cms/www/index.php?locale=es-CR,"852X+98W, Carr. a Reserva de Monteverde, Provincia de Puntarenas, Monteverde, Costa Rica",micah@micahrich.com,2645 5858,Monteverde,Hotel,,
1,Google,Hostel Paco house,http://wwwguadalupana.com/,"Provincia de Puntarenas, Santa Elena, Costa Rica",,8628 3831,Monteverde,Hotel,,
1,Google,Belcruz Bed and Breakfast,https://jiri-recommends.com/belcruz-bed-and-breakfast-costa-rica,"75 mt de la iglesia católica cañitas, Provincia de Guanacaste, Monteverde, 60109, Costa Rica",,2645 5295,Monteverde,Hotel,,
1,Google,Cala Lodge.,https://calalodge.com/,"200 m oeste y 325 sur de la Escuela Rafael Arguedas, Cerro Plano, Provincia de Puntarenas, Monteverde, Costa Rica",info@calalodge.com,2645 5626,Monteverde,Hotel,,
1,Google,Arco Iris Lodge,http://www.arcoirislodge.com/,"50 metros sur y 75 metros este del Banco Nacional de Costa Rica Provincia de Puntarenas Santa Elena Monteverde 003, Provincia de Puntarenas, Monteverde, 5655, Costa Rica",info@arcoirislodge.com,2645 5067,Monteverde,Hotel,,
1,Google,Cabinas El Pueblo B & B,http://www.cabinaselpueblo.com/,"A la par de Taco Taco en Santa Elena 50 metros sur oste del SuperCoompro Monteverde Provincia de Puntarenas CR, Provincia de Puntarenas, Monteverde, Costa Rica",info@cabinaselpueblo.com,2645 6192,Monteverde,Hotel,,
1,Google,Hotel de Cabañas Valle Campanas,http://www.vallecampanas.com/,"Carretera a Monteverde, Provincia de Puntarenas, Monteverde, 60109, Costa Rica",info@vallecampanas.com,2645 5631,Monteverde,Hotel,,
1,Google,Hidden Canopy Treehouses,http://hiddencanopy.com/,"300m este del cruce hacia las nubes camino hacia sky trek, santa elena, Provincia de Puntarenas, Monteverde, 60109, Costa Rica",,2645 5447,Monteverde,Hotel,,
1,Google,Hostel Monteverde Backpackers,https://monteverdebackpackers.com/,"50 mts south-west of Super Compro Supermarket, Santa Elena, Ruta Nacional Treciaria 606, Puntarenas Province, Monteverde, Costa Rica",monteverdebackpackers@yahoo.com,2645 5844,Monteverde,Hotel,mauricio@poveda.co.cr,
1,Google,Cattleya monteverde,http://cattleyamonteverdecr.com/,"60109 puntarenas monteverde, Provincia de Puntarenas, Monteverde, 60109, Costa Rica",book@cattleyamonteverdecr.com,8939 5093,Monteverde,Hotel,,
1,Google,Nafre House B&B Monteverde,http://www.nafrehouse.com/,"606, Provincia de Puntarenas, Monteverde, Costa Rica",nafrehouse@gmail.com,2645 5516,Monteverde,Hotel,,
1,Google,Garden House,https://www.facebook.com/Garden-House-1959961480722928/,"8588+2F9, C. 3, Provincia de Puntarenas, Monteverde, Valle Bonito, Costa Rica",,6140 2193,Monteverde,Hostel,,
1,Google,EC Management Group,http://ecmanagementcr.com/,"310 San José Pozos, San José, Santa Ana, 10903, Costa Rica",admin@ecmanagementcr.com,8892 1745,Monteverde,Property management,,
1,Google,Yerbabuena Monteverde,http://www.yerbabuenacostarica.com/,"Carretera Nacional y, Bajo del Tigre Road, Puntarenas Province, Monteverde, Costa Rica",,8818 4244,Monteverde,Property management,,
1,Google,Hotel Vista Oceana,https://hotelvistaoceana.com/,"C. Marlín 17-18-A, Centro, 63734 Sayulita, Nay., Mexico",info@hotelvistaoceana.com,322 980 0923,Sayulita,Hotel,,
1,Google,Sayulita Beach House Hotel,https://www.facebook.com/sayulitabeachousehotel/,"C. Gaviota 1, Centro, 63734 Sayulita, Nay., Mexico",housesayulitabeach@gmail.com,322 980 0913,Sayulita,Hotel,,
1,Google,Maramara,https://maramara.mx/,"Av. Revolución 74, 63728 Sayulita, Nay., Mexico",contacto@polhospitality.mx,322 348 2320,Sayulita,Hotel,,
1,Google,Hotel AzulPitaya Sayulita,https://azulpitaya.com/,"Av. del Palmar 12, centro, 63734 Sayulita, Nay., Mexico",,322 241 0741,Sayulita,Hotel,,
1,Google,La Redonda Sayulita Hostel,http://www.laredondasayulita.com/,"Manuel N. Navarrete 14, Colonia Centro, 63734 Sayulita, Nay., Mexico",info@laredondasayulita.com,329 688 4838,Sayulita,Hotel,,
1,Google,La Puesta Sayulita,https://www.lapuestasayulita.com/?utm_source=google&utm_medium=organic&utm_campaign=business-listing,"Av. del Palmar 196, 63728 Sayulita, Nay., Mexico",info@lapuestasayulita.com,322 150 7695,Sayulita,Hotel,forms@tambourine.com,
1,Google,Casa Selva,http://casaselvasayulita.com/,"C. Chachalaca 45, 63734 Sayulita, Nay., Mexico",mail@casaselvassayulita.com,322 244 1794,Sayulita,Hotel,info@casaselvasayulita.com,
1,Google,Casa Pepe Hostel Boutique Sayulita,https://hotels.cloudbeds.com/reservation/KAtxsf,"Av. Revolución 66, Centro, 63734 Sayulita, Nay., Mexico",reservations@casapepe.mx,322 378 4837,Sayulita,Hotel,reservaciones.sayulita@casapepe.mx,
1,Google,MBoutique Hotel,https://www.facebook.com/mboutiquesayulita/?ref=br_rs,"Av. Revolución 70, 63734 Sayulita, Nay., Mexico",mboutiquesayulitahotel@gmail.com,322 980 0918,Sayulita,Hotel,,
1,Google,Hotel Diamante Sayulita,https://hoteldiamantesayulita.mxhotel.site/,"Miramar, esquina, Av. del Palmar 40, 63734 Sayulita, Nay., Mexico",,33 1319 7020,Sayulita,Hotel,,
1,Google,Avela Boutique Hotel,https://www.avelahotelboutique.com/,"Libramiento Punta Mita 38 esquina con, C. Avestruz, Colonia Avestruces, 63734 Sayulita, Nay., Mexico",,322 132 2664,Sayulita,Hotel,,
1,Google,Hotel Sayulita Central & Co-Work,http://hotelsayulitacentral.com/,"Delfines 7, 63437 Sayulita, Nay., Mexico",,329 291 3845,Sayulita,Hotel,,
1,Google,Nomada Wellness Hotel,http://nomadasayulita.com/,"Caracol 11, 63728 Sayulita, Nay., Mexico",nomadasayulita@gmail.com,(206) 965 0641,Sayulita,Hotel,,
1,Google,Hotel Ysuri Sayulita,https://www.hotelysurisayulita.com/en/home.html,"Pescadores #5, 63734 Sayulita, Nay., Mexico",,322 117 8082,Sayulita,Hotel,,
1,Google,Sayulinda Hotel,https://sayulindahotel.com/,"Av. Revolución 36, 63734 Sayulita, Nay., Mexico",contacto@sayulindahotel.com,322 321 0739,Sayulita,Hotel,reservas@sayulindahotel.com,ventas@sayulindahotel.com
1,Google,Hotel Vogue,http://www.sayulitahotelvogue.com/,"C. Marlín 20, Centro, 63732 Sayulita, Nay., Mexico",,888 453 0501,Sayulita,Hotel,,
1,Google,Casa Pia,https://www.casapiasayulita.com/,"Avenida Revolución 15 Segundo Nivel, Centro, 63734 Sayulita, Nay., Mexico",casapiasayulita@gmail.com,329 296 4784,Sayulita,Hotel,,
1,Google,Ma-Jo Hotel Sayulita,https://hotels.cloudbeds.com/reservation/NmLvyV,"Delfines 10, 63728 Sayulita, Nay., Mexico",,322 318 2589,Sayulita,Hotel,,
1,Google,Hotel Samanu,http://samanu.mx/,"S/n km. 1.5 Carretera Sayulita-Higuera blanca, 63734 Sayulita, Nay., Mexico",contacto@samanu.mx,322 170 9916,Sayulita,Hotel,,
1,Google,Los Encantos Hotel y Suites,https://www.facebook.com/LosEncantosSayulita,"C. Miramar 13B, Colonia Deportiva, 63732 Sayulita, Nay., Mexico",losencantos_sayulita@hotmail.com,329 298 8515,Sayulita,Hotel,,
1,Google,Villas Amalia Hotel,https://villasamaliahotel.com/,"C. Sábalo 20, 63734 Sayulita, Nay., Mexico",,329 298 8920,Sayulita,Hotel,,
1,Google,Pacific Inn Sayulita,https://pacificinnsayulita.mxhotel.site/,"C. Manuel M. Plascencia #1, 63734 Sayulita, Nay., Mexico",,322 369 1048,Sayulita,Hotel,,
1,Google,Mar y Sueños Suites,https://marysuenos-sayulita.com/,"Rosalio Tapia 7, 63732 Sayulita, Nay., Mexico",,329 291 3686,Sayulita,Hotel,,
1,Google,Viajero Sayulita,https://www.viajerohostels.com/es/destinos-mexico/sayulita/,"C. Primavera 16, entre Av Naranjito y Av Revolución, 63734 Sayulita, Nay., Mexico",cali@viajerohostels.com,322 368 7782,Sayulita,Hotel,medellin@viajerohostels.com,marketing@viajerohostels.com
1,Google,Hotelito Los Sueños,http://hotelitolossuenos.com/?utm_source=gmb&utm_medium=organic,"Rosalio Tapia 10, Col. Nanzales C.P, 63734 Sayulita, Nay., Mexico",reservations@hotelitolossuenos.com,329 291 3690,Sayulita,Hotel,,
1,Google,Villas Tokipa,https://www.tokipa.mx/,"La Punta 1, 63734 Sayulita, Nay., Mexico",sales@tokipa.mx,322 370 4033,Sayulita,Hotel,beachclub@tokipa.mx,concierge@tokipa.mx
1,Google,Amanecer lodging,https://abnb.me/Kh4Cn2wUEbb,"C. Manuel M. Plascencia 91, 63734 Sayulita, Nay., Mexico",,322 203 2705,Sayulita,Hotel,,
1,Google,Amor Boutique Hotel,https://www.amorboutiquehotel.com/,"Pescadores S/N, 63734 Sayulita, Nay., Mexico",info@amorboutiquehotel.com,329 298 7212,Sayulita,Hotel,,
1,Google,Haramara Gardens,https://haramararetreat.com/haramara-gardens/,"Av. Revolución 110, 63728 Sayulita, Nay., Mexico",,866 801 4084,Sayulita,Hotel,,
1,Google,Sun by Wirikuta,https://abnb.me/bj8fofUbXGb,"Av. Revolución 22, 63734 Sayulita, Nay., Mexico",,322 111 1079,Sayulita,Hotel,,
1,Google,Junto al Rio Beachfront Hotel Sayulita,http://www.juntoalrio.com/,"Av. del Palmar 10, centro, 63734 Sayulita, Nay., Mexico",info@juntoalrio.com,329 291 3416,Sayulita,Hotel,,
1,Google,Casa de la Ballena,http://www.casadelaballena.com/,"C. Primavera 1, Centro, 63734 Sayulita, Nay., Mexico",info@casadelaballena.com,13222168238,Sayulita,Hotel,,
1,Google,Casa Makawe,http://www.casamakawe.com/,"Niños Heroes 11, 63734 Sayulita, Nay., Mexico",info@casamakawe.com,322 135 6256,Sayulita,Hotel,,
1,Google,Bungalows Jaqueline,http://bungalowsjaqueline.com/,"Av. Revolución 52a, 63734 Sayulita, Nay., Mexico",,329 291 3027,Sayulita,Hotel,,
1,Google,Ximena Hotel Boutique,http://www.hotelximena.com.mx/,"C. Miramar 9, 63734 Sayulita, Nay., Mexico",reservations@hotelximena.com.mx,33 3258 1847,Sayulita,Hotel,info@hotelximena.com.mx,
1,Google,Hotel Casa Loteria Sayulita,http://www.casaloteria.mx/,"C. Playa Azul 10, Centro, 63734 Sayulita, Nay., Mexico",,322 236 4785,Sayulita,Hotel,,
1,Google,La Boheme Sayulita,http://labohemesayulita.com/,"Niños Heroes 124, Centro, 63734 Sayulita, Nay., Mexico",,322 372 4974,Sayulita,Hotel,,
1,Google,My Sister's House,https://sisterssayulita.com/,"Av. Revolución 83, 63734 Sayulita, Nay., Mexico",sisterssayulita@gmail.com,322 350 3748,Sayulita,Hotel,,
1,Google,Hotel Playa Escondida,https://playa-escondida.com/,"Ave. Playa Escondida 1, 63734 Sayulita, Nay., Mexico",reservations@playa-escondida.com,(866) 636 7700,Sayulita,Hotel,,
1,Google,Amaia Boutique Hotel Sayulita,http://amaia.mx/,"C. Jose Mariscal #13, Centro, 63734 Sayulita, Nay., Mexico",info@amaia.mx,322 383 3847,Sayulita,Hotel,,
1,Google,Casablanca Sayulita Hotel,https://casablancasayulita.com/,"Av. del Palmar 79, 63734 Sayulita, Nay., Mexico",Hola@CasablancaSayulita.com,329 298 8565,Sayulita,Hotel,hola@casablancasayulita.com,
1,Google,Casa Pata Salada,http://www.casapatasalada.com/,"Casa Pata Salada S/N, Pescadores, 63734 Sayulita, Nay., Mexico",info@sayulitacasitas.com,329 291 3675,Sayulita,Hotel,,
1,Google,Selina Sayulita,http://www.selina.com/mexico/sayulita,"C. Gaviota 12, 63734 Sayulita, Nay., Mexico",,322 199 4605,Sayulita,Hotel,,
1,Google,Sayulita Villas Cantares,https://www.facebook.com/CantoSayulita/,"carretera, Punta de Mita 687, 63734 Sayulita, Nay., Mexico",,222 222 2222,Sayulita,Hotel,,
1,Google,Aurinko Bungalows,http://www.aurinkobungalows.com/,"C. Marlín 18, Centro, 63734 Sayulita, Nay., Mexico",aurinkobungalows@gmail.com,329 291 3150,Sayulita,Hotel,,
1,Google,Cult Wild Backpacker Hostel Sayulita,https://cultwildhostel.mxhotel.site/,"C. Miramar 14, Residential, 63734 Sayulita, Nay., Mexico",,33 1132 1668,Sayulita,Hostel,,
1,Google,Primavera Property Management,https://www.sayulitalife.com/casas-de-primavera,"Av. Revolución 46, Centro, 63734 Sayulita, Nay., Mexico",,,Sayulita,Property management,,
1,Google,Pacifico Property,http://www.pacificoproperty.com/,"C. Libertad 15, 63728 Sayulita, Nay., Mexico",hola@pacificoproperty.com,322 107 3959,Sayulita,Property management,,
1,Google,Sayulita Vacation Rentals by Jeffery Hill,https://www.jefferyhillvacationrentals.com/index.aspx,"Pescadores 7, Los Muertos, 63734 Sayulita, Nay., Mexico",MrJHill@aol.com,(206) 948 1100,Sayulita,Property management,,
1,Google,Avila Property Management,http://allrentalsolutions.com/,"Av. Revolución 2-B, Centro, 63734 Sayulita, Nay., Mexico",,322 245 1712,Sayulita,Property management,,
1,Google,Sayulita Coastal Properties,https://www.sayulitacoastalproperties.com/,"Av. Revolución 32-Local-C, 63734 Sayulita, Nay., Mexico",flags@2x.webp,(800) 743 2616,Sayulita,Property management,,
1,Google,MexHome Sayulita Real Estate in Riviera Nayarit,http://mexhome.com/,"Av. Revolución 25, Col. Centro, 63734 Sayulita, Nay., Mexico",info@mexhome.com,(866) 271 6887,Sayulita,Property management,,
1,Google,Andreas Vacation Rentals,http://andreasvacationrentals.com/,"94 Avenida del Palmar Pedragosa, 63734 Sayulita, Nay., Mexico",,(707) 799 3558,Sayulita,Property management,,
1,Google,Agua de Luna Hotel Boutique,https://aguadelunahotelboutique.com/,"Calle Asia, Esquina, Egipto 8, 63729 San Francisco, Nay., Mexico",contact@aguadelunaboutiquehotel.com,998 244 7101,San Francisco,Hotel,,
1,Google,Ciye Hotel,http://www.ciyehotel.mx/,"Av. Tercer Mundo 5, 63729 San Francisco, Nay., Mexico",info@ciyehotel.mx,311 129 3344,San Francisco,Hotel,,
1,Google,Hotel Ysuri San Pancho,https://www.hotelysurisanpancho.com/,"Av. Tercer Mundo 58, 63729 San Francisco, Nay., Mexico",,322 117 8082,San Francisco,Hotel,,
1,Google,Witari,https://www.witari.mx/,"Amapas 25, 63729 San Francisco, Nay., Mexico",witarihotel@gmail.com,33 3350 9558,San Francisco,Hotel,,
1,Google,DownTown Rooms,https://www.airbnb.mx/users/419068824/listings?user_id=,"Calle México Lado Estero Lado estero, 63729 San Francisco, Nay., Mexico",,322 368 9105,San Francisco,Hotel,,
1,Google,Verde Luna,https://hotels.cloudbeds.com/reservation/TtI8pr,"Av. Tercer Mundo 47, 63729 San Francisco, Nay., Mexico",verdelunasanpancho@gmail.com,322 888 6056,San Francisco,Hotel,,
1,Google,Hostal San Pancho,https://hostelsanpancho.com/,"Av. Tercer Mundo #12, Centro, 63729 San Francisco, Nay., Mexico",info@hostelsanpancho.com,311 258 4161,San Francisco,Hotel,,
1,Google,Hotel Cielo Rojo,http://www.hotelcielorojo.com/,"Asia 6, 63734 San Francisco, Nay., Mexico",info@hotelcielorojo.com,311 258 4155,San Francisco,Hotel,,
1,Google,AORA,https://aora.com.mx/,"C. Birmania 203b, 63729 San Francisco, Nay., Mexico",hello@aora.com.mx,,San Francisco,Hotel,team@latofonts.com,hello@aora.com.mx
1,Google,Marii Hotel Boutique,https://mariihotel.com/,"C. Pakistán #10, 63729 San Francisco, Nay., Mexico",,322 172 4447,San Francisco,Hotel,,
1,Google,Casa Pancho Playa. Hospedaje con Desayuno y Alberca a 10 min de la playa,https://www.booking.com/hotel/mx/casa-pancho-playa.es.html,"Av. Tercer Mundo 6-A, Centro, 63729 San Francisco, Nay., Mexico",,311 258 4861,San Francisco,Hotel,,
1,Google,Hotel de Asis,https://direct-book.com/properties/hoteldeasis_direct,"C. Mexico 32, 63729 San Francisco, Nay., Mexico",,322 888 6056,San Francisco,Hotel,,
1,Google,Palmar Hotel Tropical,http://www.palmartropical.com/,"America Latina 777, 63729 San Francisco, Nay., Mexico",info@palmartropical.com,311 258 4375,San Francisco,Hotel,,
1,Google,Akoma San Pancho,https://www.akomahospitality.com/,"Africa 8, 63729 San Francisco, Nay., Mexico",akomahospitality@gmail.com,322 888 9151,San Francisco,Hotel,,
1,Google,Maraica,http://www.maraica.mx/?utm_source=google&utm_medium=wix_google_business_profile&utm_campaign=11950033603882044241,"Las Palmas 28, 63734 San Francisco, Nay., Mexico",,311 258 4574,San Francisco,Hotel,,
1,Google,Bungalows Lydia,http://www.bungalowslydia.com/,"Las Clavelinas 393, Predio Las Juntas, 63732 San Francisco, Nay., Mexico",bungalowslydia@gmail.com,011 52 311 2584 337,San Francisco,Hotel,,
1,Google,Villas Paradise,http://www.villasparadise.info/,"Villas Paradise, Riviera Nayarit, Las Palmas 10, Riviera, 63729 San Francisco, Nay., Mexico",admin@villasparadise.info,33 3116 4522,San Francisco,Hotel,,
1,Google,Hotel Casa San Pancho,https://www.casasanpancho.com/,"C. Pakistán 156, Centro, 63734 San Francisco, Nay., Mexico",info@casasanpancho.com,311 258 5022,San Francisco,Hotel,,
1,Google,Casa Di Giulio,https://hotels.cloudbeds.com/reservation/1OIHJW,"C. Mexico 18, 63729 San Francisco, Nay., Mexico",casadigiuliosanpanchonayarit@gmail.com,322 888 6056,San Francisco,Hotel,,
1,Google,Hotelito Mar Azul,http://www.hotelitomarazul.com/,"Mexico #20 D, Centro, 63729 San Francisco, Nay., Mexico",hotelitomarazul@gmail.com,322 132 7824,San Francisco,Hotel,,
1,Google,Sundaram Ocean View Vacation Homes,https://sanpanchovacationhomes.com/,"Lote 2, Las Palmas 30, costa azul, 63729 San Francisco, Nay., Mexico",,322 237 5421,San Francisco,Hotel,,
1,Google,Casago Sayulita /San Pancho,http://casago.com/sayulita,"Africa 10, Riviera, 63729 San Francisco, Nay., Mexico",irving@casago.com,322 980 0514,San Francisco,Property management,,
1,Google,Protierra Partners Real Estate - San Pancho,http://protierrapartners.com/,"Av. Tercer Mundo 100-B, 63732 San Francisco, Nay., Mexico",sales@protierrapartners.com,322 294 2040,San Francisco,Property management,,
1,Google,SB Realtors - San Pancho,https://sbrealtors.mx/,"Av. Tercer Mundo 20, 63729 San Francisco, Nay., Mexico",info@sbrealtors.mx,322 149 2576,San Francisco,Property management,,
1,Google,San Pancho Rentals & Real Estate,https://sanpanchorentals.com/,"Africa 12, 63732 San Francisco, Nay., Mexico",info@sanpanchorentals.com,(530) 852 0751,San Francisco,Property management,,
1,Google,North Shore Realty San Pancho,http://northshorerealtysanpancho.com/,"Av. Tercer Mundo 50, 63729 San Francisco, Nay., Mexico",info@northshorerealtysanpancho.com,311 129 3296,San Francisco,Property management,,
1,Google,Wanderlust Real Estate + Development,http://wanderlustlands.com/,"Av. Tercer Mundo 73-Local 3, Centro, 63732 San Francisco, Nay., Mexico",info@wanderlustlands.com,(707) 363 5007,San Francisco,Property management,,
1,Google,Hotel Tropicana,http://www.tropicanavallarta.com/,"Amapas 214, Zona Romántica, PlayaLos Muertos, 48380 Puerto Vallarta, Jal., Mexico",reservaciones@tropicanavallarta.com,322 226 9696,Puerto Vallarta,Hotel,,
1,Google,Hotel Portonovo Plaza Puerto Vallarta,http://www.hotelportonovoplaza.com/nuestros-hoteles-en-jalisco-mexico/portonovo-plaza-puerto-vallarta,"Av México 1125, 5 de Diciembre, 48350 Puerto Vallarta, Jal., Mexico",,322 222 2291,Puerto Vallarta,Hotel,,
1,Google,Ten to Ten Puerto Vallarta,https://tentotentoten.com/en/hostel/puertovallarta/,"C. Juárez 467, Proyecto escola, Centro, 48300 Puerto Vallarta, Jal., Mexico",,322 315 0171,Puerto Vallarta,Hotel,,
1,Google,Hotel & Suites Coral,https://hotelsuitescoral.mxhotel.site/,"C. Sierra Aconcagua 140, Lázaro Cárdenas, 48330 Puerto Vallarta, Jal., Mexico",,322 222 4074,Puerto Vallarta,Hotel,,
1,Google,Hotel Vista Hermosa Aeropuerto Puerto Vallarta,http://www.hotel-vistahermosa-puertovallarta.com/,"Canarios 160, Villa Las Flores, 48335 Puerto Vallarta, Jal., Mexico",hotelvistahermosavallarta@gmail.com,322 248 1786,Puerto Vallarta,Hotel,,
1,Google,Hotel Hacienda Vallarta Playa Las Glorias,https://haciendavallartaglorias.com/,"Lucerna 103, Versalles, 48310 Puerto Vallarta, Jal., Mexico",,322 224 1229,Puerto Vallarta,Hotel,,
1,Google,Hotel El Pescador,https://www.hotelelpescador.com/,"Paraguay 1117, Centro, 48350 Puerto Vallarta, Jal., Mexico",reserva@hotelrosita.com,322 176 1100,Puerto Vallarta,Hotel,,
1,Google,Hotel Belmar Galeria,http://www.belmarvallarta.com/,"Insurgentes 161, Zona Romántica, Emiliano Zapata, 48380 Puerto Vallarta, Jal., Mexico",info@belmarvallarta.com,322 222 0572,Puerto Vallarta,Hotel,,
1,Google,Emperador Vallarta Beachfront Hotel & Suites,http://www.hotelemperadorpv.com/,"Amapas 114, Zona Romántica, Emiliano Zapata, 48380 Puerto Vallarta, Jal., Mexico",info@hotelemperadorpv.com,322 222 1767,Puerto Vallarta,Hotel,,
1,Google,Container Inn Hotel Aeropuerto,http://www.containerinn.com.mx/,"Av. Francisco Medina Ascencio 4634, Guadalupe Victoria, 48317 Puerto Vallarta, Jal., Mexico",reservas@containerinn.com.mx,322 113 4772,Puerto Vallarta,Hotel,,
